Question,Source,Type
What were the significant contributions of Ada Lovelace to the field of computing?,Ada Lovelace.txt,single-hop
How did Ada Lovelace's early life and education influence her career as a mathematician?,Ada Lovelace.txt,single-hop
In what ways did Ada Lovelace collaborate with Charles Babbage on the Analytical Engine?,Ada Lovelace.txt,single-hop
What was the significance of the algorithm Ada Lovelace published for the Analytical Engine?,Ada Lovelace.txt,single-hop
How is Ada Lovelace remembered and celebrated today in relation to women in STEM?,Ada Lovelace.txt,single-hop
What contributions to mathematics did Isaac Newton make during his lifetime?,Isaac Newton.txt,single-hop
How did the Great Plague influence Isaac Newton's scientific development?,Isaac Newton.txt,single-hop
In what ways did Newton's scientific achievements lay the foundations for modern physics?,Isaac Newton.txt,single-hop
What positions did Isaac Newton hold later in his life after his academic career?,Isaac Newton.txt,single-hop
How did Newton's personal beliefs and character traits affect his relationships with contemporaries?,Isaac Newton.txt,single-hop
What major theories did Albert Einstein develop that are considered pillars of modern physics?,Albert Einstein.txt,single-hop
How did Einstein's equation E=mc² change our understanding of mass and energy?,Albert Einstein.txt,single-hop
What significant scientific contribution did Einstein make regarding the photoelectric effect?,Albert Einstein.txt,single-hop
What challenges did Einstein face in his personal life while pursuing his scientific career?,Albert Einstein.txt,single-hop
How has Einstein's legacy and influence persisted in the field of physics after his death?,Albert Einstein.txt,single-hop
What was Charles Darwin's most famous contribution to science?,Charles Darwin.txt,single-hop
How did Darwin's early education influence his interest in natural history?,Charles Darwin.txt,single-hop
What discoveries did Darwin make during his voyage on the HMS Beagle?,Charles Darwin.txt,single-hop
What were the key elements of Darwin's theory of evolution by natural selection?,Charles Darwin.txt,single-hop
How has Darwin's legacy impacted fields outside of biology?,Charles Darwin.txt,single-hop
What was Marie Curie's significance in the field of radioactivity?,Marie Sklodowska.txt,single-hop
How did Marie Curie's family background influence her education?,Marie Sklodowska.txt,single-hop
What notable achievements did Marie Curie accomplish during World War I?,Marie Sklodowska.txt,single-hop
"In which years did Marie Curie win her Nobel Prizes, and in what fields?",Marie Sklodowska.txt,single-hop
What were the health consequences of Marie Curie's research on radiation exposure?,Marie Sklodowska.txt,single-hop
Which scientists contributed to the foundations of modern physics and what are their key theories or discoveries?,multiple,multi-hop
How did Ada Lovelace's work on the Analytical Engine connect with the later developments in computing by Albert Einstein?,multiple,multi-hop
In what ways did Charles Darwin's theory of evolution intersect with the scientific principles established by Isaac Newton?,multiple,multi-hop
"What were the primary fields of study pursued by both Marie Curie and Ada Lovelace, and how did their contributions influence scientific understanding in their respective areas?",multiple,multi-hop
How did the personal challenges faced by Marie Curie compare to those encountered by Ada Lovelace in their professional lives?,multiple,multi-hop
What connections can be drawn between the theories of natural selection proposed by Charles Darwin and the laws of motion formulated by Isaac Newton?,multiple,multi-hop
"How did the historical contexts of Isaac Newton and Albert Einstein influence their scientific achievements, particularly in relation to the study of gravity?",multiple,multi-hop
"Which notable achievements did Albert Einstein and Isaac Newton accomplish that significantly changed the course of physics, and how do they relate?",multiple,multi-hop
How did the analytical methods of Ada Lovelace in computing parallel the experimental techniques employed by Marie Curie in her research on radioactivity?,multiple,multi-hop
In what ways did the professional environments of female scientists like Ada Lovelace and Marie Curie reflect the gender norms of their respective eras?,multiple,multi-hop
